{
  "schemaVersion": "1.0.0",
  "evaluationTime": "2026-07-25T00:00:00Z",
  "status": "completed",
  "resultDigest": "sha256:404a460a44e640957fb36a7ae66080ca6403bd449b5596c13b55d5cfd6261f41",
  "findings": [],
  "errors": [],
  "summary": {
    "findingTotal": 0,
    "errorTotal": 0,
    "findingsBySeverity": {
      "error": 0,
      "high": 0,
      "medium": 0,
      "low": 0,
      "info": 0
    },
    "scannedFiles": 1,
    "scannedOperations": 1,
    "excludedOperations": 0,
    "riskyOperations": 0,
    "truncatedFindings": 0
  },
  "gate": {
    "outcome": "pass",
    "failOn": "high",
    "causingFindingFingerprints": []
  },
  "provenance": {
    "core": {
      "name": "proof-core",
      "version": "0.1.0",
      "digest": "sha256:1111111111111111111111111111111111111111111111111111111111111111"
    },
    "validator": {
      "name": "openapi-spec-validator",
      "version": "0.9.0",
      "digest": "sha256:2222222222222222222222222222222222222222222222222222222222222222"
    },
    "rulePack": {
      "name": "agent-contract",
      "version": "0.1.0",
      "digest": "sha256:3333333333333333333333333333333333333333333333333333333333333333"
    },
    "runtime": {
      "name": "cpython",
      "version": "3.14.6",
      "digest": "sha256:4444444444444444444444444444444444444444444444444444444444444444"
    },
    "configuration": {
      "digest": "sha256:5555555555555555555555555555555555555555555555555555555555555555"
    },
    "input": {
      "digest": "sha256:6666666666666666666666666666666666666666666666666666666666666666"
    }
  }
}
